Mitigation Strategy,Details
Lime,Applied in fields and storage to reduce rot and fungal spread.
Salt,Added to planting hills; thought to prevent both insects and blight.
Copper (Bluestone),"Treated seed tubers before planting, an early form of modern fungicide."
Manure Control,Observed higher disease in heavily manured fields; adjustments made to fertilization practices.
Drying (Sand/Ash),Tubers stored in dry sand or ash to prevent moisture-induced rot in storage.
Tobacco Juice,"Used to deter insects, based on belief that pests were carriers of the disease."
Sulfur,"Sprinkled over plants to inhibit fungal growth, based on traditional agricultural practices."
